{
  "schema_version": "1.0",
  "execution_sequence": [
    {
      "tasks": ["37"],
      "description": "stable ANN IDs: `video_id+host -> int64`"
    },
    {
      "tasks": ["33"],
      "description": "video-page similars diversity + larger pools"
    },
    {
      "tasks": ["3"],
      "description": "video metadata completeness + refresh mutable fields"
    },
    {
      "tasks": ["1", "2"],
      "description": "video-page UX flow for similars"
    },
    {
      "tasks": ["4", "9", "9b"],
      "description": "description + single-like removal"
    },
    {
      "tasks": ["12a", "8b"],
      "description": "popular weighted-random + feed modes"
    },
    {
      "tasks": ["10", "8c"],
      "description": "about outbound analytics"
    },
    {
      "tasks": ["41", "38", "43"],
      "description": "timestamped lifecycle logs + request correlation + static-page visit logs"
    },
    {
      "tasks": ["16l", "39", "44", "56", "40"],
      "description": "cache runtime safety + similarity precompute scope + shadow swap + zero-downtime deploy"
    },
    {
      "tasks": ["16", "11"],
      "description": "docs + docstrings"
    },
    {
      "tasks": ["70", "71", "72", "73"],
      "description": "workflow CLI + sync/materialize/confirm automation"
    },
    {
      "tasks": ["94", "95"],
      "description": "feature checklist sync and issue approved gate"
    },
    {
      "tasks": ["182", "183", "184", "185"],
      "description": "F7 Draft lifecycle model and validation gate implementation"
    },
    {
      "tasks": ["186", "187", "188", "189"],
      "description": "F7 plan issue draft-file input and Draft-state write behavior"
    },
    {
      "tasks": ["190", "191", "192", "193"],
      "description": "F7 canonical plan and status command routing with legacy cleanup"
    },
    {
      "tasks": ["194", "195", "196", "197"],
      "description": "F7 protocol and workflow rewrite for Draft validation lifecycle"
    },
    {
      "tasks": ["198", "199", "200", "201"],
      "description": "F9 strict confirm feature cleanup contract and implementation"
    },
    {
      "tasks": ["202", "203", "204", "205"],
      "description": "F9 explicit child-issue cascade mode for confirm feature"
    },
    {
      "tasks": ["206", "207", "208", "209"],
      "description": "F9 issue-scoped execution commit policy and GitHub visibility guidance"
    },
    {
      "tasks": ["210", "211", "212", "213"],
      "description": "F10 explicit feature issue publication contract and runtime"
    },
    {
      "tasks": ["214", "215", "216", "217"],
      "description": "F10 explicit child issue publication and feature-owned issue batches"
    },
    {
      "tasks": ["218", "219", "220", "221"],
      "description": "F10 publish-oriented help, workflow docs, and migration cleanup"
    },
    {
      "tasks": ["222", "223", "224", "225"],
      "description": "F11 milestone execution-order block structure and parser support"
    },
    {
      "tasks": ["226", "227", "228", "229"],
      "description": "F11 planning and sync maintenance for milestone feature execution order"
    },
    {
      "tasks": ["230", "231", "232", "233"],
      "description": "F11 confirm cleanup and docs for milestone execution-order lifecycle"
    },
    {
      "tasks": ["234"],
      "description": "Expose canonical get-context CLI routing before collector implementation."
    },
    {
      "tasks": ["235", "236"],
      "description": "Implement feature and issue context payload collectors on shared tracker resolvers."
    },
    {
      "tasks": ["237", "238"],
      "description": "Align execution workflows/protocol with collector-first read contract."
    },
    {
      "tasks": ["239"],
      "description": "Lock CLI command-surface regressions in core help tests."
    },
    {
      "tasks": ["240", "241"],
      "description": "Lock payload and naming regression behavior for execution context commands."
    },
    {
      "tasks": ["242", "243", "244"],
      "description": "Define and enforce strict Dependencies line format before parser and index work."
    },
    {
      "tasks": ["245", "246", "247", "248"],
      "description": "Add dependency index command surface, parser, scoped reads, and tests."
    },
    {
      "tasks": ["249", "250", "251", "252"],
      "description": "Introduce dedicated overlaps artifact, validation, and migration guards."
    },
    {
      "tasks": ["253", "254", "255", "256"],
      "description": "Implement overlap read/build/apply commands and workflow contract."
    },
    {
      "tasks": ["257", "258", "259"],
      "description": "Make plan-tasks consume dedicated overlap context and stop overlap writes."
    },
    {
      "tasks": ["260", "261", "262"],
      "description": "Clean overlap and dependency-index artifacts during confirm flows."
    },
    {
      "tasks": ["263", "264", "265", "266"],
      "description": "Migrate overlap storage out of pipeline and cut runtime over to overlaps-only."
    }
  ],
  "functional_blocks": [
    {
      "title": "Block A: Similarity and recommendation core",
      "tasks": ["37", "33", "12a"],
      "scope": "ANN/similarity defaults, impacted recompute, upnext diversity, popular-layer sampling quality.",
      "outcome": "ANN switches to stable `ann_id` mapping, upnext refresh stops repeating the same 8 cards, and popular feed uses weighted-random by similarity instead of flat random sampling."
    },
    {
      "title": "Block B: Video page data + UX behavior",
      "tasks": ["3", "1", "2", "4", "9", "9b"],
      "scope": "metadata completeness, fast similar rendering, comments, profile/likes interactions.",
      "outcome": "video page loads similars immediately (without waiting for remote metadata), renders progressive similars from one larger batch on scroll, shows tags/category with mutable-field refresh, supports read-only comments with pagination, has collapsible description, and allows removing one like instead of only full reset."
    },
    {
      "title": "Block C: Feed and discovery product features",
      "tasks": ["8b", "10", "15"],
      "scope": "feed modes, search UX/API, crawler seed mode from one instance/subscriptions.",
      "outcome": "home page gets explicit feed mode switch (`recommendations/hot/recent/random/popular`), backend exposes video search API (`/api/search/videos` with paging/sort), and crawler can start from one `--seed-instance` and expand through federated subscriptions."
    },
    {
      "title": "Block D: Analytics and style infrastructure",
      "tasks": ["8c", "8"],
      "scope": "outbound click analytics and optional styling-system consolidation.",
      "outcome": "About-page outbound links send tracked events to a dedicated API endpoint and SQLite analytics table (with validation/rate-limit path), while repeated styling patterns can be migrated to a shared Tailwind-based system for new blocks."
    },
    {
      "title": "Block E: Documentation and maintenance",
      "tasks": ["16", "11"],
      "scope": "recommendations docs alignment and missing docstrings.",
      "outcome": "`RECOMMENDATIONS_OVERVIEW` is aligned with actual runtime pipeline (candidate generation/mixing/filters), and touched modules/functions/classes have explicit docstrings so behavior is readable without code archaeology."
    },
    {
      "title": "Block F: Logging and observability",
      "tasks": ["41", "38", "43"],
      "scope": "explicit timestamped request logs, request-id correlation across request lifecycle, and static-page visit visibility for About/static informational pages.",
      "outcome": "every API request gets `request-start -> work logs -> request-end` with one shared `request_id` and explicit timestamp format, and nginx adds dedicated visit logs for static informational routes with request-correlation-compatible fields."
    },
    {
      "title": "Block G: Runtime reliability and operations",
      "tasks": ["16l", "39", "44", "56", "40"],
      "scope": "safe cache refresh/swap runtime behavior (random + similarity), scoped similarity precompute updates, and automated blue/green nginx cutover.",
      "outcome": "random/similarity caches refresh via shadow files + atomic swap, updater similarity stage can rewrite scoped cache sources instead of full rebuilds, and deploy script performs blue/green switch on `7070/7071` with health-check gate and rollback."
    },
    {
      "title": "Block H: Workflow automation for planning/materialization execution",
      "tasks": ["70", "71", "72", "73"],
      "scope": "unified workflow CLI, feature lifecycle base commands, tracker sync+validation automation, and completion/materialization command contracts.",
      "outcome": "the process flow (`create/plan/approve/sync/materialize/execute/confirm`) runs through `dev/workflow` with deterministic tracker updates, `task_count`-based ID allocation, canonical feature branch handling, and confirmation cascade with GitHub close."
    },
    {
      "title": "Block J: Materialize mode split and issue-level gates",
      "tasks": ["94", "95"],
      "scope": "explicit materialize modes, scoped issue materialization, create-only behavior, feature checklist sync, and issue-level approval gate enforcement.",
      "outcome": "workflow materialize becomes explicitly mode-driven, supports one-issue targeting, avoids unwanted edits in create-only mode, keeps feature issue checklist in sync, and enforces issue-level approval before execution and issue materialization."
    },
    {
      "title": "Block M: Draft planning lifecycle and canonical status surface",
      "tasks": ["182", "183", "184", "185", "186", "187", "188", "189", "190", "191", "192", "193", "194", "195", "196", "197"],
      "scope": "planning lifecycle status model, validation commands, draft-file issue planning, canonical status routing, and protocol/workflow alignment.",